{
  "$comment": "This file is autogenerated, do not edit manually, see https://github.com/SAP/abap-file-formats for more information.",
  "$schema": "https://json-schema.org/draft/2020-12/schema",
  "$id": "https://github.com/SAP/abap-file-formats/blob/main/file-formats/intm/intm-v1.json",
  "title": "Intelligent scenario Models",
  "description": "Intelligent scenario Models",
  "type": "object",
  "properties": {
    "formatVersion": {
      "title": "Format Version",
      "description": "Format version",
      "type": "string",
      "const": "1"
    },
    "header": {
      "title": "Header",
      "description": "Header",
      "type": "object",
      "properties": {
        "description": {
          "title": "Description",
          "description": "Description of the ABAP object",
          "type": "string",
          "maxLength": 60
        },
        "originalLanguage": {
          "title": "Original Language",
          "description": "Original language of the ABAP object",
          "type": "string",
          "minLength": 2
        },
        "abapLanguageVersion": {
          "title": "ABAP Language Version",
          "description": "ABAP language version",
          "type": "string",
          "enum": [
            "standard",
            "keyUser",
            "cloudDevelopment"
          ],
          "enumTitles": [
            "Standard",
            "ABAP for Key Users",
            "ABAP Cloud Development"
          ],
          "enumDescriptions": [
            "Standard",
            "ABAP for key user extensibility",
            "ABAP cloud development"
          ],
          "default": "standard"
        }
      },
      "additionalProperties": false,
      "required": [
        "description",
        "originalLanguage"
      ]
    },
    "islmModelcc": {
      "title": "Intelligent Scenario Model",
      "description": "Intelligent Scenario Model",
      "type": "object",
      "properties": {
        "name": {
          "title": "Model Name",
          "description": "Model Name",
          "type": "string",
          "maxLength": 30
        },
        "parent": {
          "title": "Parent",
          "description": "Parent",
          "type": "string",
          "maxLength": 36
        },
        "description": {
          "title": "Model Description",
          "description": "Model Description",
          "type": "string"
        },
        "modelType": {
          "title": "Model Type",
          "description": "Model Type",
          "type": "string",
          "maxLength": 256
        },
        "adapterId": {
          "title": "Adapter ID",
          "description": "Adapter ID",
          "type": "string",
          "maxLength": 32
        },
        "nativeModelType": {
          "title": "Native Model Type",
          "description": "Native Model Type",
          "type": "string",
          "maxLength": 256
        },
        "modelSpecification": {
          "title": "Model Content",
          "description": "Model Content",
          "type": "string"
        },
        "modelDefinition": {
          "title": "Model definition",
          "description": "Model definition",
          "type": "string"
        },
        "state": {
          "title": "State of model",
          "description": "State of model",
          "type": "string",
          "maxLength": 10
        },
        "signature": {
          "title": "Signature",
          "description": "Signature",
          "type": "string"
        },
        "bindings": {
          "title": "Bindings",
          "description": "Bindings",
          "type": "string"
        },
        "newModel": {
          "title": "Model flag: Original = ' ', Enhancement = 'X'",
          "description": "New model?",
          "type": "boolean"
        },
        "abapLanguageVersion": {
          "title": "ABAP Language Version",
          "description": "ABAP Language Version",
          "type": "string",
          "maxLength": 1
        }
      },
      "additionalProperties": false
    },
    "islmModel": {
      "title": "Model Details",
      "description": "Model Details",
      "type": "object",
      "properties": {
        "executableId": {
          "title": "Executable ID",
          "description": "Executable ID",
          "type": "string",
          "maxLength": 64
        },
        "llmName": {
          "title": "Large Language Model Name",
          "description": "Large Language Model Name",
          "type": "string"
        },
        "llmModelVersion": {
          "title": "LLM Model Version",
          "description": "LLM Model Version",
          "type": "string",
          "maxLength": 30
        }
      },
      "additionalProperties": false
    },
    "islmMdlsgmntfld": {
      "title": "Model Segment Fields",
      "description": "Model Segment Fields",
      "type": "array",
      "items": {
        "title": "Model Segment Fields",
        "description": "Model Segment Fields",
        "type": "object",
        "properties": {
          "fieldname": {
            "title": "Table or view field name",
            "description": "Table or view field name",
            "type": "string",
            "maxLength": 30
          },
          "fieldPosition": {
            "title": "Position",
            "description": "Position",
            "type": "integer",
            "minimum": -2147483648,
            "maximum": 2147483647
          },
          "isKey": {
            "title": "Key field Boolean flag?",
            "description": "Key field Boolean flag?",
            "type": "boolean"
          }
        },
        "additionalProperties": false
      }
    },
    "islmMdlprmttmpl": {
      "title": "Model Prompt Templates",
      "description": "Model Prompt Templates",
      "type": "array",
      "items": {
        "title": "Intelligent Scenario Model Prompt Template",
        "description": "Intelligent Scenario Model Prompt Template",
        "type": "object",
        "properties": {
          "name": {
            "title": "Prompt template name",
            "description": "Prompt template name",
            "type": "string",
            "maxLength": 30
          },
          "description": {
            "title": "Description",
            "description": "Description",
            "type": "string"
          },
          "prompt": {
            "title": "Prompt",
            "description": "Prompt",
            "type": "string"
          },
          "promptParameters": {
            "title": "Prompt Parameters",
            "description": "Prompt Parameters",
            "type": "string"
          },
          "visible": {
            "title": "Prompt Visibility",
            "description": "Prompt Visibility",
            "type": "boolean"
          }
        },
        "additionalProperties": false,
        "required": [
          "name",
          "prompt"
        ]
      }
    }
  },
  "additionalProperties": false,
  "required": [
    "formatVersion",
    "header",
    "islmModelcc",
    "islmModel"
  ]
}
